{
  "$schema": "https://json-schema.org/draft/2020-12/schema",
  "$id": "https://github.com/CZSK-MicroHacks/MicroHack-AppInnovation/contracts/telemetry-query-result.schema.json",
  "title": "Normalized telemetry query result",
  "type": "object",
  "additionalProperties": false,
  "required": [
    "schemaVersion",
    "queryId",
    "rows",
    "workspaceId",
    "capturedAt",
    "queryText"
  ],
  "properties": {
    "schemaVersion": {
      "const": "1.0.0"
    },
    "queryId": {
      "enum": [
        "resources",
        "traces",
        "metrics",
        "logs"
      ]
    },
    "rows": {
      "type": "array",
      "minItems": 1,
      "items": {
        "type": "object",
        "additionalProperties": false,
        "required": [
          "signalName",
          "recordCount",
          "observedAttributes"
        ],
        "properties": {
          "signalName": {
            "type": "string",
            "minLength": 1
          },
          "recordCount": {
            "type": "integer",
            "minimum": 1
          },
          "observedAttributes": {
            "type": "array",
            "uniqueItems": true,
            "items": {
              "type": "string",
              "minLength": 1
            }
          },
          "resourceAttributes": {
            "type": "object",
            "additionalProperties": {
              "type": "string"
            }
          },
          "unit": {
            "type": "string",
            "minLength": 1
          },
          "measurements": {
            "type": "array",
            "minItems": 1,
            "items": {
              "type": "object",
              "additionalProperties": false,
              "required": [
                "value",
                "attributes"
              ],
              "properties": {
                "value": {
                  "type": "number"
                },
                "attributes": {
                  "type": "object",
                  "additionalProperties": {
                    "type": [
                      "string",
                      "number",
                      "integer",
                      "boolean"
                    ]
                  }
                }
              }
            }
          },
          "observations": {
            "type": "array",
            "minItems": 1,
            "items": {
              "type": "object",
              "additionalProperties": false,
              "required": [
                "attributes"
              ],
              "properties": {
                "attributes": {
                  "type": "object",
                  "additionalProperties": {
                    "type": [
                      "string",
                      "number",
                      "integer",
                      "boolean"
                    ]
                  }
                }
              }
            }
          }
        }
      }
    },
    "workspaceId": {
      "type": "string",
      "minLength": 1,
      "description": "Log Analytics workspace ID or resource ID the rows were read from."
    },
    "capturedAt": {
      "type": "string",
      "format": "date-time",
      "description": "RFC 3339 timestamp at which the query was executed."
    },
    "queryText": {
      "type": "string",
      "minLength": 1,
      "description": "Verbatim query executed to produce these rows."
    }
  },
  "allOf": [
    {
      "if": {
        "properties": {
          "queryId": {
            "const": "metrics"
          }
        },
        "required": [
          "queryId"
        ]
      },
      "then": {
        "properties": {
          "rows": {
            "items": {
              "required": [
                "unit",
                "measurements"
              ]
            }
          }
        }
      }
    },
    {
      "if": {
        "properties": {
          "queryId": {
            "enum": [
              "traces",
              "logs"
            ]
          }
        },
        "required": [
          "queryId"
        ]
      },
      "then": {
        "properties": {
          "rows": {
            "items": {
              "required": [
                "observations"
              ]
            }
          }
        }
      }
    }
  ]
}
